{
  "$schema": "https://json-schema.org/draft/2020-12/schema",
  "$id": "https://autoon.dev/schemas/person.json",
  "title": "Person",
  "description": "A person with contact information",
  "type": "object",
  "properties": {
    "firstName": {
      "type": "string",
      "description": "The person's first name"
    },
    "lastName": {
      "type": "string",
      "description": "The person's last name"
    },
    "age": {
      "type": "integer",
      "minimum": 0,
      "description": "Age in years"
    },
    "email": {
      "type": "string",
      "format": "email",
      "description": "Email address"
    },
    "address": {
      "type": "object",
      "properties": {
        "street": { "type": "string" },
        "city": { "type": "string" },
        "state": { "type": "string" },
        "zipCode": { "type": "string", "pattern": "^[0-9]{5}(-[0-9]{4})?$" }
      },
      "required": ["street", "city", "state", "zipCode"]
    },
    "phoneNumbers": {
      "type": "array",
      "items": {
        "type": "object",
        "properties": {
          "type": { "type": "string", "enum": ["home", "work", "mobile"] },
          "number": { "type": "string" }
        },
        "required": ["type", "number"]
      }
    },
    "isActive": {
      "type": "boolean",
      "default": true
    }
  },
  "required": ["firstName", "lastName"]
}
